{
  "schemaVersion": 1,
  "catalogVersion": "1.0.0",
  "defaults": {
    "smokeEnabled": true
  },
  "contracts": {
    "managedProfileMarkers": {
      "start": "# >>> DEREKALGOS INIT >>>",
      "end": "# <<< DEREKALGOS INIT <<<"
    },
    "managedProfileExports": [
      "DEREKALGOS_TIMEOUT",
      "DEREKALGOS_EIFFEL",
      "DEREKALGOS_GCC13",
      "DEREKALGOS_GCC13NAME",
      "DEREKALGOS_GXX13NAME",
      "DEREKALGOS_RUNONDOCKER",
      "DEREKALGOS_RUNONSSH"
    ],
    "routeFormats": {
      "docker": {
        "mapEntryPattern": "lang=image"
      },
      "ssh": {
        "legacy": {
          "fieldCount": 3,
          "separator": "|"
        },
        "explicit": {
          "fieldCount": 5,
          "separator": "|"
        }
      }
    }
  },
  "languages": [
    {
      "key": "acton",
      "extension": "act",
      "displayLabel": "Acton",
      "icon": {
        "fileName": "acton.svg"
      },
      "sampleOutputTemplate": "./output/$fileNameWithoutExt",
      "smoke": {
        "defaultEnabled": true,
        "visible": true
      },
      "constraints": {
        "canRun": [
          {
            "platform": [
              "*"
            ],
            "arch": [
              "*"
            ]
          }
        ]
      },
      "aliases": {
        "languageIds": [
          "acton"
        ],
        "fileExtensions": [
          ".act"
        ]
      }
    },
    {
      "key": "ada",
      "extension": "adb",
      "displayLabel": "Ada",
      "icon": {
        "fileName": "ada.svg"
      },
      "sampleOutputTemplate": "./output/$fileNameWithoutExt",
      "smoke": {
        "defaultEnabled": true,
        "visible": true
      },
      "constraints": {
        "canRun": [
          {
            "platform": [
              "*"
            ],
            "arch": [
              "*"
            ]
          }
        ]
      },
      "aliases": {
        "languageIds": [
          "ada"
        ],
        "fileExtensions": [
          ".adb"
        ]
      }
    },
    {
      "key": "apl",
      "extension": "apl",
      "displayLabel": "APL",
      "icon": {
        "fileName": "apl.svg"
      },
      "sampleOutputTemplate": "./output/$fileName",
      "smoke": {
        "defaultEnabled": true,
        "visible": true
      },
      "constraints": {
        "canRun": [
          {
            "platform": [
              "*"
            ],
            "arch": [
              "*"
            ]
          }
        ]
      },
      "aliases": {
        "languageIds": [
          "apl"
        ],
        "fileExtensions": [
          ".apl"
        ]
      }
    },
    {
      "key": "arm64asm",
      "extension": "s",
      "displayLabel": "ARM64 ASM",
      "icon": {
        "fileName": "assembly.svg"
      },
      "sampleOutputTemplate": "./output/$fileNameWithoutExt",
      "smoke": {
        "defaultEnabled": false,
        "visible": true,
        "reasonIfDisabledByDefault": "Requires Darwin arm64 runtime support."
      },
      "constraints": {
        "canRun": [
          {
            "platform": [
              "Darwin"
            ],
            "arch": [
              "arm64"
            ],
            "note": "arm64asm runner supports Darwin arm64 only."
          }
        ]
      },
      "aliases": {
        "languageIds": [
          "arm64asm"
        ],
        "fileExtensions": [
          ".s"
        ]
      }
    },
    {
      "key": "asm",
      "extension": "asm",
      "displayLabel": "ASM",
      "icon": {
        "fileName": "assembly.svg"
      },
      "sampleOutputTemplate": "./output/$fileNameWithoutExt",
      "smoke": {
        "defaultEnabled": true,
        "visible": true
      },
      "constraints": {
        "canRun": [
          {
            "platform": [
              "*"
            ],
            "arch": [
              "*"
            ]
          }
        ]
      },
      "aliases": {
        "languageIds": [
          "asm",
          "asm-intel-x86-generic",
          "x86asm"
        ],
        "fileExtensions": [
          ".asm"
        ]
      }
    },
    {
      "key": "ballerina",
      "extension": "bal",
      "displayLabel": "Ballerina",
      "icon": {
        "fileName": "ballerina.svg"
      },
      "sampleOutputTemplate": "./output/$fileNameWithoutExt.jar",
      "smoke": {
        "defaultEnabled": true,
        "visible": true
      },
      "constraints": {
        "canRun": [
          {
            "platform": [
              "*"
            ],
            "arch": [
              "*"
            ]
          }
        ]
      },
      "aliases": {
        "languageIds": [
          "ballerina"
        ],
        "fileExtensions": [
          ".bal"
        ]
      }
    },
    {
      "key": "c",
      "extension": "c",
      "displayLabel": "C",
      "icon": {
        "fileName": "c.svg"
      },
      "sampleOutputTemplate": "./output/$fileNameWithoutExt",
      "smoke": {
        "defaultEnabled": true,
        "visible": true
      },
      "constraints": {
        "canRun": [
          {
            "platform": [
              "*"
            ],
            "arch": [
              "*"
            ]
          }
        ]
      },
      "aliases": {
        "languageIds": [
          "c"
        ],
        "fileExtensions": [
          ".c"
        ]
      }
    },
    {
      "key": "c3",
      "extension": "c3",
      "displayLabel": "C3",
      "icon": {
        "fileName": "c3.svg"
      },
      "sampleOutputTemplate": "./output/$fileNameWithoutExt",
      "smoke": {
        "defaultEnabled": true,
        "visible": true
      },
      "constraints": {
        "canRun": [
          {
            "platform": [
              "*"
            ],
            "arch": [
              "*"
            ]
          }
        ]
      },
      "aliases": {
        "languageIds": [
          "c3"
        ],
        "fileExtensions": [
          ".c3"
        ]
      }
    },
    {
      "key": "clisp",
      "extension": "lisp",
      "displayLabel": "Common Lisp",
      "icon": {
        "fileName": "lisp.svg"
      },
      "sampleOutputTemplate": "./output/$fileNameWithoutExt.fasl",
      "smoke": {
        "defaultEnabled": true,
        "visible": true
      },
      "constraints": {
        "canRun": [
          {
            "platform": [
              "*"
            ],
            "arch": [
              "*"
            ]
          }
        ]
      },
      "aliases": {
        "languageIds": [
          "clisp"
        ],
        "fileExtensions": [
          ".lisp"
        ]
      }
    },
    {
      "key": "clojure",
      "extension": "clj",
      "displayLabel": "Clojure",
      "icon": {
        "fileName": "clojure.svg"
      },
      "sampleOutputTemplate": "./output/target/uberjar/$fileNameWithoutExt-1.0.0-standalone.jar",
      "smoke": {
        "defaultEnabled": true,
        "visible": true
      },
      "constraints": {
        "canRun": [
          {
            "platform": [
              "*"
            ],
            "arch": [
              "*"
            ]
          }
        ]
      },
      "aliases": {
        "languageIds": [
          "clojure"
        ],
        "fileExtensions": [
          ".clj"
        ]
      }
    },
    {
      "key": "cobol",
      "extension": "cob",
      "displayLabel": "COBOL",
      "icon": {
        "fileName": "cobol.svg"
      },
      "sampleOutputTemplate": "./output/$fileNameWithoutExt",
      "smoke": {
        "defaultEnabled": true,
        "visible": true
      },
      "constraints": {
        "canRun": [
          {
            "platform": [
              "*"
            ],
            "arch": [
              "*"
            ]
          }
        ]
      },
      "aliases": {
        "languageIds": [
          "cobol"
        ],
        "fileExtensions": [
          ".cob"
        ]
      }
    },
    {
      "key": "cpp",
      "extension": "cpp",
      "displayLabel": "C++",
      "icon": {
        "fileName": "cpp.svg"
      },
      "sampleOutputTemplate": "./output/$fileNameWithoutExt",
      "smoke": {
        "defaultEnabled": true,
        "visible": true
      },
      "constraints": {
        "canRun": [
          {
            "platform": [
              "*"
            ],
            "arch": [
              "*"
            ]
          }
        ]
      },
      "aliases": {
        "languageIds": [
          "cpp"
        ],
        "fileExtensions": [
          ".cpp"
        ]
      }
    },
    {
      "key": "csharp",
      "extension": "cs",
      "displayLabel": "C#",
      "icon": {
        "fileName": "csharp.svg"
      },
      "sampleOutputTemplate": "./output/bin/Debug/net10.0/$fileNameWithoutExt",
      "smoke": {
        "defaultEnabled": true,
        "visible": true
      },
      "constraints": {
        "canRun": [
          {
            "platform": [
              "*"
            ],
            "arch": [
              "*"
            ]
          }
        ]
      },
      "aliases": {
        "languageIds": [
          "csharp"
        ],
        "fileExtensions": [
          ".cs"
        ]
      }
    },
    {
      "key": "d",
      "extension": "d",
      "displayLabel": "D",
      "icon": {
        "fileName": "d.svg"
      },
      "sampleOutputTemplate": "./output/$fileNameWithoutExt",
      "smoke": {
        "defaultEnabled": true,
        "visible": true
      },
      "constraints": {
        "canRun": [
          {
            "platform": [
              "*"
            ],
            "arch": [
              "*"
            ]
          }
        ]
      },
      "aliases": {
        "languageIds": [
          "d"
        ],
        "fileExtensions": [
          ".d"
        ]
      }
    },
    {
      "key": "dart",
      "extension": "dart",
      "displayLabel": "Dart",
      "icon": {
        "fileName": "dart.svg"
      },